<?xml version="1.0" encoding="UTF-8"?>
<!-- Structure of data/pests.xml: the identification quiz and the pest guide. -->
<xs:schema xmlns:xs="http://www.w3.org/2001/XMLSchema" elementFormDefault="qualified">

  <xs:simpleType name="Id">
    <xs:restriction base="xs:string"><xs:pattern value="[a-z0-9-]+"/></xs:restriction>
  </xs:simpleType>

  <xs:simpleType name="Tone">
    <xs:restriction base="xs:string">
      <xs:enumeration value="green"/><xs:enumeration value="amber"/><xs:enumeration value="red"/>
    </xs:restriction>
  </xs:simpleType>

  <xs:element name="catalogue">
    <xs:complexType>
      <xs:sequence>
        <xs:element name="quiz">
          <xs:complexType>
            <xs:sequence>
              <xs:element name="question" minOccurs="1" maxOccurs="unbounded">
                <xs:complexType>
                  <xs:sequence>
                    <xs:element name="option" minOccurs="2" maxOccurs="unbounded">
                      <xs:complexType>
                        <xs:simpleContent>
                          <xs:extension base="xs:string">
                            <xs:attribute name="id" type="Id" use="required"/>
                            <xs:attribute name="icon" type="xs:string"/>
                            <xs:attribute name="hint" type="xs:string"/>
                          </xs:extension>
                        </xs:simpleContent>
                      </xs:complexType>
                    </xs:element>
                  </xs:sequence>
                  <xs:attribute name="id" type="Id" use="required"/>
                  <xs:attribute name="title" type="xs:string" use="required"/>
                  <xs:attribute name="style" default="tiles">
                    <xs:simpleType><xs:restriction base="xs:string"><xs:enumeration value="tiles"/><xs:enumeration value="pills"/></xs:restriction></xs:simpleType>
                  </xs:attribute>
                </xs:complexType>
              </xs:element>
            </xs:sequence>
          </xs:complexType>
        </xs:element>

        <xs:element name="pest" minOccurs="1" maxOccurs="unbounded">
          <xs:complexType>
            <xs:sequence>
              <xs:element name="name" type="xs:string"/>
              <xs:element name="species">
                <xs:complexType>
                  <xs:simpleContent>
                    <xs:extension base="xs:string"><xs:attribute name="scientific" type="xs:string" use="required"/></xs:extension>
                  </xs:simpleContent>
                </xs:complexType>
              </xs:element>
              <xs:element name="where" type="xs:string"/>
              <xs:element name="advice" type="xs:string"/>
              <xs:element name="included" type="xs:string"/>
              <xs:element name="variables" type="xs:string"/>
              <xs:element name="prep">
                <xs:complexType><xs:sequence><xs:element name="step" type="xs:string" maxOccurs="unbounded"/></xs:sequence></xs:complexType>
              </xs:element>
              <xs:element name="alsoConsider" type="xs:string" minOccurs="0"/>
              <xs:element name="cues">
                <xs:complexType>
                  <xs:sequence>
                    <xs:element name="cue" maxOccurs="unbounded">
                      <xs:complexType>
                        <xs:attribute name="question" type="Id" use="required"/>
                        <xs:attribute name="answer" type="Id" use="required"/>
                        <xs:attribute name="weight" type="xs:positiveInteger" use="required"/>
                      </xs:complexType>
                    </xs:element>
                  </xs:sequence>
                </xs:complexType>
              </xs:element>
            </xs:sequence>
            <xs:attribute name="id" type="Id" use="required"/>
            <xs:attribute name="tag" type="xs:string" use="required"/>
            <xs:attribute name="tone" type="Tone" use="required"/>
          </xs:complexType>
        </xs:element>
      </xs:sequence>
    </xs:complexType>
    <!-- every pest id is unique -->
    <xs:unique name="uniquePest"><xs:selector xpath="pest"/><xs:field xpath="@id"/></xs:unique>
  </xs:element>
</xs:schema>
